{
  "name": "apache",
  "version": "0.0.1",
  "readme": "To start use \"apachectl start -f $HTTPD_CONFDIR/httpd.conf\".\n\nIf you with to edit the config file, please copy it out of the .devbox directory.",
  "env": {
    "HTTPD_CONFDIR": "{{ .DevboxRoot }}/conf/apache",
    "HTTPD_PORT": "8080"
  },
  "create_files": {
    ".devbox/conf/apache/httpd.conf": "apache/httpd.conf"
  }
}
