{
  "name": "postgresql",
  "version": "0.0.1",
  "readme": "To initialize the database, run `initdb`. To start the database, run `pg_ctl -l .devbox/conf/postgresql/logfile start`. To stop use `pg_ctl stop`.",
  "env": {
    "PGDATA": "{{ .DevboxRoot }}/conf/postgresql/data"
  },
  "create_files": {
    ".devbox/conf/postgresql/data": ""
  }
}
