{
  "name": "my-plugin",
  "version": "0.0.1",
  "readme": "Example custom plugin",
  "env": {
    "MY_FOO_VAR": "BAR"
  },
  "create_files": {
    "{{ .Virtenv }}/empty-dir": "",
    "{{ .Virtenv }}/some-file": "some-file.txt",
    "{{ .DevboxDir }}/some-file.txt": "some-file.txt",
    "{{ .Virtenv }}/process-compose.yaml": "process-compose.yaml"
  },
  "shell": {
      "init_hook": [
          "export MY_INIT_HOOK_VAR=BAR"
      ]
  }
}
